reference_id,article_title,matched_title,score,matched_doi,meta_id,query_type
b2,Post traumatic cervical anterolithesis: comprehensive evaluation and expert opinion,Post Traumatic Cervical Anterolithesis: Comprehensive Evaluation And Expert Opinion,70,10.1016/j.jtumed.2018.03.009,https://w3id.org/oc/meta/br/061902033913,author_title
b4,The functional movement screen: a reliability study,The Functional Movement Screen: A Reliability Study,70,10.2519/jospt.2012.3838,https://w3id.org/oc/meta/br/0640407087,author_title
b7,One-leg stance in healthy young and elderly adults: a measure of postural steadiness?,One-leg Stance In Healthy Young And Elderly Adults: A Measure Of Postural Steadiness?,70,10.1016/j.clinbiomech.2004.04.002,https://w3id.org/oc/meta/br/061401740893,author_title
b8,"Effects of a predefined mini-trampoline training programme on balance, mobility and activities of daily living after stroke: a randomized controlled pilot study","Effects Of A Predefined Mini-Trampoline Training Programme On Balance, Mobility And Activities Of Daily Living After Stroke: A Randomized Controlled Pilot Study",70,10.1177/0269215513485591,https://w3id.org/oc/meta/br/06803516929,author_title
b14,Right versus left side bridge static endurance ability among healthy collegiate students at Taibah University,Right Versus Left Side Bridge Static Endurance Ability Among Healthy Collegiate Students At Taibah University,70,10.3233/bmr-169538,https://w3id.org/oc/meta/br/06101605843,author_title
b16,Large postural fluctuations but unchanged postural sway dynamics during tiptoe standing compared to quiet standing,Large Postural Fluctuations But Unchanged Postural Sway Dynamics During Tiptoe Standing Compared To Quiet Standing,70,10.1016/j.jelekin.2012.05.006,https://w3id.org/oc/meta/br/061801329354,author_title
