reference_id,article_title,matched_title,score,matched_doi,meta_id,query_type
ref_3,Pathophysiology of human spermatozoa,Pathophysiology Of Human Spermatozoa,70,10.1097/00001703-199404000-00004,https://w3id.org/oc/meta/br/06140565295,author_title
ref_4,Recent progress in the preservation of ram semen,Recent Progress In The Preservation Of Ram Semen,70,10.1016/0378-4320(96)01544-8,https://w3id.org/oc/meta/br/062202825591,author_title
ref_5,Fertilizing capacity and ultrastructure of fowl and Turkey spermatozoa before and after freezing,Fertilizing Capacity And Ultrastructure Of Fowl And Turkey Spermatozoa Before And After Freezing,70,10.1530/jrf.0.0550001,https://w3id.org/oc/meta/br/062201030317,author_title
ref_6,Maintenance of bioenergetic balance in sperm and prevention of lipid peroxidation: a review of the effect on design of storage preservation systems,Maintenance Of Bioenergetic Balance In Sperm And Prevention Of Lipid Peroxidation: A Review Of The Effect On Design Of Storage Preservation Systems,70,10.1071/rd9930675,https://w3id.org/oc/meta/br/06101854522,author_title
ref_7,Mammalian fertilization,Immunological Block To Mammalian Fertilization: Survival And Organ Distribution Of Immunoglobulin Which Inhibits Fertilization In Vivo.,50,10.1073/pnas.73.7.2405,https://w3id.org/oc/meta/br/062403052152,author_title
ref_8,Spontaneous lipid peroxidation in rabbit epididymal spermatozoa: its effect on sperm motility,Spontaneous Lipid Peroxidation In Rabbit Epididymal Spermatozoa: Its Effect On Sperm Motility,70,10.1095/biolreprod27.5.1102,https://w3id.org/oc/meta/br/0650322044,author_title
ref_12,Sperm nuclear DNA damage and altered chromatin structure: effect on fertilization and embryo development,Sperm Nuclear DNA Damage And Altered Chromatin Structure: Effect On Fertilization And Embryo Development,70,10.1093/humrep/13.suppl_4.11,https://w3id.org/oc/meta/br/06220200016,author_title
ref_14,Role of glutathione peroxidase in protecting mammalian spermatozoa from loss of motility caused by spontaneous lipid peroxidation,Role Of Glutathione Peroxidase In Protecting Mammalian Spermatozoa From Loss Of Motility Caused By Spontaneous Lipid Peroxidation,70,10.1002/mrd.1120230108,https://w3id.org/oc/meta/br/061703146124,author_title
ref_15,Role of antioxidants in the treatment of male infertility,Role Of Antioxidants In The Treatment Of Male Infertility,70,10.1111/j.1442-2042.2009.02280.x,https://w3id.org/oc/meta/br/06901085075,author_title
ref_19,"Oxidative stress, osmotic stress and apoptosis: impacts on sperm function and preservation in the horse","Oxidative Stress, Osmotic Stress And Apoptosis: Impacts On Sperm Function And Preservation In The Horse",70,10.1016/j.anireprosci.2008.04.014,https://w3id.org/oc/meta/br/062502820621,author_title
ref_20,Effect of oxidative stress on male reproduction,Effect Of Oxidative Stress On Male Reproduction,70,10.5534/wjmh.2014.32.1.1,https://w3id.org/oc/meta/br/06601650525,author_title
ref_22,"The effect of antioxidants on motility, viability, acrosome integrity and DNA integrity of frozen-thawed epididymal cat spermatozoa","The Effect Of Antioxidants On Motility, Viability, Acrosome Integrity And DNA Integrity Of Frozen-Thawed Epididymal Cat Spermatozoa",70,10.1016/j.theriogenology.2008.04.005,https://w3id.org/oc/meta/br/06703499074,author_title
ref_23,"Taurine, hypotaurine, epinephrine and albumin inhibit lipid peroxidation in rabbit spermatozoa and protect against loss of motility","Taurine, Hypotaurine, Epinephrine And Albumin Inhibit Lipid Peroxidation In Rabbit Spermatozoa And Protect Against Loss Of Motility",70,10.1095/biolreprod29.3.548,https://w3id.org/oc/meta/br/0620319695,author_title
ref_25,The cryoprotective effects of ascorbic acid supplementation on bovine semen quality,The Cryoprotective Effects Of Ascorbic Acid Supplementation On Bovine Semen Quality,70,10.1016/j.anireprosci.2010.04.180,https://w3id.org/oc/meta/br/062502820197,author_title
ref_30,Differences in ability of jennies and mares to conceive with cooled and frozen semen containing glycerol or not,Differences In Ability Of Jennies And Mares To Conceive With Cooled And Frozen Semen Containing Glycerol Or Not,70,10.1016/j.anireprosci.2008.03.016,https://w3id.org/oc/meta/br/062502820646,author_title
ref_32,Strategies to improve the fertility of fresh and frozen donkey semen,Strategies To Improve The Fertility Of Fresh And Frozen Donkey Semen,70,10.1016/j.theriogenology.2015.12.010,https://w3id.org/oc/meta/br/06403518702,author_title
ref_33,Some reproductive parameters of Zanskari Mares reared in an organized farm under tropical climate,Some Reproductive Parameters Of Zanskari Mares Reared In An Organized Farm Under Tropical Climate,70,10.56093/ijans.v86i2.55797,https://w3id.org/oc/meta/br/06380192933,author_title
ref_34,"Effects of different concentration and combinations of cryoprotectants on sperm quality, functional integrity in three Indian horse breeds","Effects Of Different Concentration And Combinations Of Cryoprotectants On Sperm Quality, Functional Integrity In Three Indian Horse Breeds",70,10.1016/j.cryobiol.2018.12.005,https://w3id.org/oc/meta/br/06140270895,author_title
ref_38,"Protective effect of taurine, glutathione and trehalose on the liquid storage of ram semen","Protective Effect Of Taurine, Glutathione And Trehalose On The Liquid Storage Of Ram Semen",70,10.1016/j.smallrumres.2006.12.001,https://w3id.org/oc/meta/br/06190368247,author_title
ref_39,Effect of method and clinician on stallion sperm morphology evaluation,Effect Of Method And Clinician On Stallion Sperm Morphology Evaluation,70,10.1016/j.theriogenology.2011.04.007,https://w3id.org/oc/meta/br/06603513070,author_title
ref_44,Adding cholesterol to the stallion sperm plasma membrane improves cryosurvival,Adding Cholesterol To The Stallion Sperm Plasma Membrane Improves Cryosurvival,70,10.1016/j.cryobiol.2005.07.004,https://w3id.org/oc/meta/br/06160276546,author_title
ref_52,Effect of various concentrations of butylated hydroxyanisole and butylated hydroxytoluene on freezing capacity of Turkman stallion sperm,Effect Of Various Concentrations Of Butylated Hydroxyanisole And Butylated Hydroxytoluene On Freezing Capacity Of Turkman Stallion Sperm,70,10.1016/j.anireprosci.2016.04.010,https://w3id.org/oc/meta/br/062402823350,author_title
ref_54,Seminal parameters and field fertility of cryopreserved donkey jack semen after insemination of horse mares,Seminal Parameters And Field Fertility Of Cryopreserved Donkey Jack Semen After Insemination Of Horse Mares,70,10.1111/j.2042-3306.2010.00130.x,https://w3id.org/oc/meta/br/062401676410,author_title
ref_59,Influence of cryopreservation on mitochondrial functions in equine spermatozoa,Influence Of Cryopreservation On Mitochondrial Functions In Equine Spermatozoa,70,10.1016/j.theriogenology.2007.06.004,https://w3id.org/oc/meta/br/06803505215,author_title
ref_60,"Determination of glutathione peroxidase and superoxide dismutase-like activities in equine spermatozoa, seminal plasma, and reproductive tissues","Determination Of Glutathione Peroxidase And Superoxide Dismutase-Like Activities In Equine Spermatozoa, Seminal Plasma, And Reproductive Tissues",70,10.2460/ajvr.2005.66.1415,https://w3id.org/oc/meta/br/061402178842,author_title
ref_62,Optimal concentrations of cryoprotective agents for semen from stallions that are classified ‘good’ or ‘poor’ for freezing,Optimal Concentrations Of Cryoprotective Agents For Semen From Stallions That Are Classified ‘Good’ Or ‘Poor’ For Freezing,70,10.1016/j.anireprosci.2011.03.001,https://w3id.org/oc/meta/br/062502819952,author_title
ref_63,Cryopreservation induces mitochondrial permeability transition in a bovine sperm model,Cryopreservation Induces Mitochondrial Permeability Transition In A Bovine Sperm Model,70,10.1016/j.cryobiol.2018.06.001,https://w3id.org/oc/meta/br/06140270952,author_title
ref_64,Effects of glutamine on post-thaw motility of stallion spermatozoa: an approach of the mechanism of action at spermatozoa level,Effects Of Glutamine On Post-Thaw Motility Of Stallion Spermatozoa: An Approach Of The Mechanism Of Action At Spermatozoa Level,70,10.1016/j.theriogenology.2004.04.012,https://w3id.org/oc/meta/br/06903120950,author_title
ref_65,Improvement of motility and fertilization potential of postthaw human sperm using glutamine,Improvement Of Motility And Fertilization Potential Of Postthaw Human Sperm Using Glutamine,70,10.1006/cryo.1996.0031,https://w3id.org/oc/meta/br/06190280074,author_title
ref_67,Supplementing cryopreservation media with reduced glutathione increases fertility and prolificacy of sows inseminated with frozen-thawed boar semen,Supplementing Cryopreservation Media With Reduced Glutathione Increases Fertility And Prolificacy Of Sows Inseminated With Frozen-Thawed Boar Semen,65,10.1111/j.2047-2927.2013.00144.x,https://w3id.org/oc/meta/br/0610568705,author_title
ref_69,Sperm cryodamage occurs after rapid freezing phase: flow cytometry approach and antioxidant enzymes activity at different stages of cryopreservation,Sperm Cryodamage Occurs After Rapid Freezing Phase: Flow Cytometry Approach And Antioxidant Enzymes Activity At Different Stages Of Cryopreservation,70,10.1186/s40104-016-0076-x,https://w3id.org/oc/meta/br/06202618432,author_title
ref_72,Effect of antioxidant supplementation on semen quality and reactive oxygen species of frozen-thawed canine spermatozoa,Effect Of Antioxidant Supplementation On Semen Quality And Reactive Oxygen Species Of Frozen-Thawed Canine Spermatozoa,70,10.1016/j.theriogenology.2007.04.053,https://w3id.org/oc/meta/br/06803505301,author_title
