reference_id,article_title,matched_title,score,matched_doi,meta_id,query_type
ref_1,J. Hazard. Mater.,Corrigendum To “Removal Of Aqueous Hg(II) And Cr(VI) Using Phytic Acid Doped Polyaniline/Cellulose Acetate Composite Mem Brane” [J. Hazard. Mater. 280 (2014) 20–30],70,10.1016/j.jhazmat.2015.10.070,https://w3id.org/oc/meta/br/061402381421,author_title
ref_4,Small,The Impact Of Chemotherapy On EGFR Mutation Status In Non-Small-Cell Lung Cancer: A Meta-Analysis,70,10.4236/ojgen.2017.74010,https://w3id.org/oc/meta/br/0690459267,author_title
ref_6,Nature,Nature Of Ceramide In Bovine Milk,70,10.1017/s0022029900013789,https://w3id.org/oc/meta/br/061102601591,author_title
ref_8,Nanoscale,Field Emission From A Large Area Of Vertically-Aligned Carbon Nanofibers With Nanoscale Tips And Controlled Spatial Geometry,50,10.1016/j.carbon.2009.12.026,https://w3id.org/oc/meta/br/06301391999,author_title
ref_11,Nanoscale,Detection Of Cellular Spikes And Classification Of Cells From Raw Nanoscale Biosensor Data,70,10.1007/978-3-319-57421-9_7,https://w3id.org/oc/meta/br/061702258102,author_title
ref_13,Mater. Lett.,Retraction Notice To “Preparation And Characterization Of Vertically Aligned ZnO Microrods On Glass Substrate” [Mater. Lett. 97 (2013) 71–73],50,10.1016/j.matlet.2014.12.044,https://w3id.org/oc/meta/br/06110458611,author_title
