reference_id,article_title,matched_title,score,matched_doi,meta_id,query_type
ref_1,J Chem Technol Biotechnol,Softwood Hydrolysate As A Carbon Source For Polyhydroxyalkanoate Production,65,10.1002/jctb.4196,https://w3id.org/oc/meta/br/0650820777,year_and_doi
ref_2,Bioresour Technol,Effect Of Cultivation Parameters On The Production Of Poly(3-Hydroxybutyrate-Co-4-Hydroxybutyrate) And Poly(3-Hydroxybutyrate-4-Hydroxybutyrate-3-Hydroxyvalerate) By Cupriavidus Necator Using Waste Glycerol,70,10.1016/j.biortech.2012.01.176,https://w3id.org/oc/meta/br/06180116628,year_and_doi
ref_3,Microorganisms in biorefineries,Lignocellulosic Hydrolysates For The Production Of Polyhydroxyalkanoates,65,10.1007/978-3-662-45209-7_4,https://w3id.org/oc/meta/br/061702632469,year_and_doi
ref_4,New Biotechnol,Enhanced Bioproduction Of Poly-3-Hydroxybutyrate From Wheat Straw Lignocellulosic Hydrolysates,70,10.1016/j.nbt.2013.10.004,https://w3id.org/oc/meta/br/061502170535,year_and_doi
ref_7,Sustain Prod Consum,Producing PHAs In The Bioeconomy — Towards A Sustainable Bioplastic,70,10.1016/j.spc.2016.09.001,https://w3id.org/oc/meta/br/06250324285,year_and_doi
ref_8,Biomacromolecules,Model Study To Assess Softwood Hemicellulose Hydrolysates As The Carbon Source For PHB Production In Paraburkholderia Sacchari IPT 101,65,10.1021/acs.biomac.7b01446,https://w3id.org/oc/meta/br/0636061076,year_and_doi
ref_10,"Sustainable production of fuels, chemicals, and fibers from forest biomass. ACS symposium series",Integrated Forest Biorefinery – Prehydrolysis/Dissolving Pulping Process,65,10.1021/bk-2011-1067.ch018,https://w3id.org/oc/meta/br/06103442767,year_and_doi
ref_11,Sci Adv,"Production, Use, And Fate Of All Plastics Ever Made",70,10.1126/sciadv.1700782,https://w3id.org/oc/meta/br/0620640434,year_and_doi
