reference_id,article_title,matched_title,score,matched_doi,meta_id,query_type
ref_8,Ecological Applications,High Dose Rate Gynecological Applications — Radiobiological Considerations Based On The Α-Β Model,65,10.1016/0167-8140(92)90016-n,https://w3id.org/oc/meta/br/06180150503,author_title
ref_20,Science,Chemistry And Material Science At The Cell Surface,70,10.1016/s1369-7021(10)70056-0,https://w3id.org/oc/meta/br/06140340632,author_title
ref_21,Ecology,Cueva De Los Torrejones Revisited. New Insights On The Paleoecology Of Inland Iberia During The Late Pleistocene,50,10.1016/j.quascirev.2020.106765,https://w3id.org/oc/meta/br/06190733117,author_title
ref_28,Nature,Nature Index Tables,70,10.1038/519s78a,https://w3id.org/oc/meta/br/0650350285,year_volume_page
ref_40,Science,Awareness Of Both Type 1 And 2 Errors In Climate Science And Assessment,65,10.1175/bams-d-13-00115.1,https://w3id.org/oc/meta/br/06240621464,author_title
ref_41,Quatern Int,On Solutions Of The Quaternion Matrix Equation AX=B And Their Applications In Color Image Restoration,45,10.1016/j.amc.2013.05.069,https://w3id.org/oc/meta/br/06203746143,year_author_page
ref_61,Natural Hazards & Earth System Sciences,Eラーニングによる学習効果の検討,70,10.24675/helesje.11.0_33,https://w3id.org/oc/meta/br/06460313943,year_volume_page
