reference_id,article_title,matched_title,score,matched_doi,meta_id,query_type
b0,Sensitivity- and Uncertainty-Based Criticality Safety Validation Techniques,Sensitivity- And Uncertainty-Based Criticality Safety Validation Techniques,70,10.13182/nse03-2,https://w3id.org/oc/meta/br/061101851663,year_volume_page
b2,Notes on Regression and Inheritance in the Case of Two Parents,VII. Note On Regression And Inheritance In The Case Of Two Parents,65,10.1098/rspl.1895.0041,https://w3id.org/oc/meta/br/06602825240,year_volume_page
b8,Whisper: Sensitivity/ Uncertainty-Based Computational Methods and Software for Determining Baseline Upper Subcritical Limits,Whisper: Sensitivity/Uncertainty-Based Computational Methods And Software For Determining Baseline Upper Subcritical Limits,70,10.13182/nse14-99,https://w3id.org/oc/meta/br/061101851122,year_volume_page
b16,SCALE Continuous-Energy Eigenvalue Sensitivity Coefficient Calculations,SCALE Continuous-Energy Eigenvalue Sensitivity Coefficient Calculations,70,10.13182/nse15-12,https://w3id.org/oc/meta/br/06901865053,year_volume_page
b18,Determination and Application of Partial Biases in Criticality Safety Validation,Determination And Application Of Partial Biases In Criticality Safety Validation,70,10.13182/nse10-109,https://w3id.org/oc/meta/br/061101851435,year_volume_page
b22,Development of a Generalized Perturbation Theory Method for Sensitivity Analysis Using Continuous-Energy Monte Carlo Methods,Development Of A Generalized Perturbation Theory Method For Sensitivity Analysis Using Continuous-Energy Monte Carlo Methods,70,10.13182/nse15-13,https://w3id.org/oc/meta/br/06901865046,year_volume_page
