reference_id,article_title,matched_title,score,matched_doi,meta_id,query_type
b1,The extreme male brain theory of autism,The Extreme Male Brain Theory Of Autism,70,10.1016/s1364-6613(02)01904-6,https://w3id.org/oc/meta/br/06180216137,year_volume_page
b2,"The hyper-systemizing, assortative mating theory of autism","The Hyper-Systemizing, Assortative Mating Theory Of Autism",70,10.1016/j.pnpbp.2006.01.010,https://w3id.org/oc/meta/br/06190205871,year_volume_page
b3,Autism: The Empathizing-Systemizing (E-S) Theory,Autism: The Empathizing-Systemizing (E-S) Theory,70,10.1111/j.1749-6632.2009.04467.x,https://w3id.org/oc/meta/br/06503103515,year_volume_page
b4,"Empathizing, systemizing, and the extreme male brain theory of autism","Empathizing, Systemizing, And The Extreme Male Brain Theory Of Autism",70,10.1016/b978-0-444-53630-3.00011-7,https://w3id.org/oc/meta/br/062603185108,year_author_page
b5,Elevated fetal steroidogenic activity in autism,Elevated Fetal Steroidogenic Activity In Autism,65,10.1038/mp.2014.48,https://w3id.org/oc/meta/br/06120824181,year_volume_page
b6,"The systemizing quotient: an investigation of adults with Asperger syndrome or high–functioning autism, and normal sex differences","The Systemizing Quotient: An Investigation Of Adults With Asperger Syndrome Or High–Functioning Autism, And Normal Sex Differences",70,10.1098/rstb.2002.1206,https://w3id.org/oc/meta/br/061303011109,year_volume_page
b7,"The Empathy Quotient: An Investigation of Adults with Asperger Syndrome or High Functioning Autism, and Normal Sex Differences","The Empathy Quotient: An Investigation Of Adults With Asperger Syndrome Or High Functioning Autism, And Normal Sex Differences",70,10.1023/b:jadd.0000022607.19833.00,https://w3id.org/oc/meta/br/06150588682,year_volume_page
b9,The Broad Autism (Endo)Phenotype: Neurostructural and Neurofunctional Correlates in Parents of Individuals with Autism Spectrum Disorders,The Broad Autism (Endo)Phenotype: Neurostructural And Neurofunctional Correlates In Parents Of Individuals With Autism Spectrum Disorders,70,10.3389/fnins.2016.00346,https://w3id.org/oc/meta/br/06601718511,author_title
b10,"Autism risk factors: genes, environment, and gene-environment interactions","Autism Risk Factors: Genes, Environment, And Gene-Environment Interactions",70,10.31887/dcns.2012.14.3/pchaste,https://w3id.org/oc/meta/br/061601512079,year_volume_page
b11,The endophenotype concept in psychiatric genetics,The Endophenotype Concept In Psychiatric Genetics,65,10.1017/s0033291706008750,https://w3id.org/oc/meta/br/06501325505,year_volume_page
b12,Network-specific sex differentiation of intrinsic brain function in males with autism,Network-specific Sex Differentiation Of Intrinsic Brain Function In Males With Autism,70,10.1186/s13229-018-0192-x,https://w3id.org/oc/meta/br/06220710439,author_title
b13,The genetics of autistic disorders and its clinical relevance: a review of the literature,The Genetics Of Autistic Disorders And Its Clinical Relevance: A Review Of The Literature,65,10.1038/sj.mp.4001896,https://w3id.org/oc/meta/br/06130828167,year_volume_page
b14,The Broader Autism Phenotype and Its Implications on the Etiology and Treatment of Autism Spectrum Disorders,The Broader Autism Phenotype And Its Implications On The Etiology And Treatment Of Autism Spectrum Disorders,70,10.1155/2011/545901,https://w3id.org/oc/meta/br/061401129980,author_title
b16,The Endophenotype Concept in Psychiatry: Etymology and Strategic Intentions,The Endophenotype Concept In Psychiatry: Etymology And Strategic Intentions,70,10.1176/appi.ajp.160.4.636,https://w3id.org/oc/meta/br/06702557202,year_volume_page
b17,Testing the Empathizing-ystemizing theory of sex differences and the Extreme Male Brain theory of autism in half a million people,Testing The Empathizing–Systemizing Theory Of Sex Differences And The Extreme Male Brain Theory Of Autism In Half A Million People,70,10.1073/pnas.1811032115,https://w3id.org/oc/meta/br/06403476969,year_volume_page
b18,"Empathizing, systemizing, and autistic traits: Latent structure in individuals with autism, their parents, and general population controls","Empathizing, Systemizing, And Autistic Traits: Latent Structure In Individuals With Autism, Their Parents, And General Population Controls.",70,10.1037/a0031919,https://w3id.org/oc/meta/br/062201468907,year_volume_page
b19,Broader autism phenotype in mothers predicts social responsiveness in young children with autism spectrum disorders,Broader Autism Phenotype In Mothers Predicts Social Responsiveness In Young Children With Autism Spectrum Disorders,65,10.1111/pcn.12210,https://w3id.org/oc/meta/br/06190423024,year_volume_page
b20,The Broad Autism Phenotype Questionnaire,The Broad Autism Phenotype Questionnaire,65,10.1007/s10803-006-0299-3,https://w3id.org/oc/meta/br/06140579488,year_volume_page
b21,A Higher Mutational Burden in Females Supports a “Female Protective Model” in Neurodevelopmental Disorders,A Higher Mutational Burden In Females Supports A “Female Protective Model” In Neurodevelopmental Disorders,70,10.1016/j.ajhg.2014.02.001,https://w3id.org/oc/meta/br/06170927296,year_volume_page
b22,Disentangling the heterogeneity of autism spectrum disorder through genetic findings,Disentangling The Heterogeneity Of Autism Spectrum Disorder Through Genetic Findings,70,10.1038/nrneurol.2013.278,https://w3id.org/oc/meta/br/061802874574,year_volume_page
b23,Empathizing-systemizing cognitive styles: Effects of sex and academic degree,Empathizing-systemizing Cognitive Styles: Effects Of Sex And Academic Degree,70,10.1371/journal.pone.0194515,https://w3id.org/oc/meta/br/062501513993,year_volume_page
b24,Individual differences in brain structure underpin empathizing–systemizing cognitive styles in male adults,Individual Differences In Brain Structure Underpin Empathizing–Systemizing Cognitive Styles In Male Adults,70,10.1016/j.neuroimage.2012.03.018,https://w3id.org/oc/meta/br/06501336192,year_volume_page
b25,N/A,Autism Diagnostic Observation Schedule,65,10.1007/978-0-387-79948-3_1520,https://w3id.org/oc/meta/br/06803567064,author_title
b26,Defining key features of the broad autism phenotype: A comparison across parents of multiple- and single-incidence autism families,Defining Key Features Of The Broad Autism Phenotype: A Comparison Across Parents Of Multiple- And Single-Incidence Autism Families,70,10.17615/xtb6-kw40,https://w3id.org/oc/meta/br/0650217177,year_volume_page
b27,Broader Autism Phenotype in Siblings of Children with ASD—A Review,Broader Autism Phenotype In Siblings Of Children With ASD—A Review,70,10.3390/ijms160613217,https://w3id.org/oc/meta/br/061401410569,year_volume_page
b28,Environmental toxicants and autism spectrum disorders: a systematic review,Environmental Toxicants And Autism Spectrum Disorders: A Systematic Review,70,10.1038/tp.2014.4,https://w3id.org/oc/meta/br/0647032679,author_title
b29,Broader Autism Phenotype in Parents of Children with Autism: A Systematic Review of Percentage Estimates,Broader Autism Phenotype In Parents Of Children With Autism: A Systematic Review Of Percentage Estimates,70,10.1007/s10826-018-1026-3,https://w3id.org/oc/meta/br/061603116908,year_volume_page
b30,The Broader Autism Phenotype in Mothers is Associated with Increased Discordance Between Maternal-Reported and Clinician-Observed Instruments that Measure Child Autism Spectrum Disorder,The Broader Autism Phenotype In Mothers Is Associated With Increased Discordance Between Maternal-Reported And Clinician-Observed Instruments That Measure Child Autism Spectrum Disorder,70,10.1007/s10803-017-3248-4,https://w3id.org/oc/meta/br/06110591132,year_volume_page
b31,Regional Gray Matter Volume Is Associated with Empathizing and Systemizing in Young Adults,Regional Gray Matter Volume Is Associated With Empathizing And Systemizing In Young Adults,70,10.1371/journal.pone.0084782,https://w3id.org/oc/meta/br/061101528977,year_volume_page
b32,Heritability of autism spectrum disorders: a meta-analysis of twin studies,Heritability Of Autism Spectrum Disorders: A Meta-Analysis Of Twin Studies,65,10.1111/jcpp.12499,https://w3id.org/oc/meta/br/0640951190,year_volume_page
b35,Measuring Empathizing and Systemizing with a Large US Sample,Measuring Empathizing And Systemizing With A Large US Sample,70,10.1371/journal.pone.0031661,https://w3id.org/oc/meta/br/061801520815,year_volume_page
b36,A unified genetic theory for sporadic and inherited autism,A Unified Genetic Theory For Sporadic And Inherited Autism,70,10.1073/pnas.0705803104,https://w3id.org/oc/meta/br/06203478035,year_volume_page
