reference_id,article_title,matched_title,score,matched_doi,meta_id,query_type
b4,Minimally-invasive glaucoma surgeries (MIGS) for open angle glaucoma: a systematic review and meta-analysis,Minimally-invasive Glaucoma Surgeries (MIGS) For Open Angle Glaucoma: A Systematic Review And Meta-Analysis,70,10.1371/journal.pone.0183142,https://w3id.org/oc/meta/br/061101524572,author_title
b5,"A randomised, controlled comparison of latanoprostene bunod and latanoprost 0.005% in the treatment of ocular hypertension and open angle glaucoma: the VOYAGER study","A Randomised, Controlled Comparison Of Latanoprostene Bunod And Latanoprost 0.005% In The Treatment Of Ocular Hypertension And Open Angle Glaucoma: The VOYAGER Study",70,10.1136/bjophthalmol-2014-305908,https://w3id.org/oc/meta/br/0634053104,author_title
b6,Cerebrospinal fluid pressure may play a role in reversal of cupping after glaucoma surgery,Cerebrospinal Fluid Pressure May Play A Role In Reversal Of Cupping After Glaucoma Surgery,70,10.1016/j.ajo.2009.06.002,https://w3id.org/oc/meta/br/06250922204,author_title
b7,Cerebrospinal fluid pressure is decreased in primary open-angle glaucoma,Cerebrospinal Fluid Pressure Is Decreased In Primary Open-angle Glaucoma,70,10.1016/j.ophtha.2008.01.013,https://w3id.org/oc/meta/br/0632030948,author_title
b8,Intracranial pressure and glaucoma,Intracranial Pressure And Glaucoma,70,10.1097/icu.0b013e32833651d8,https://w3id.org/oc/meta/br/06160573725,author_title
b13,"Optic disc edema, globe flattening, choroidal folds, and hyperopic shifts observed in astronauts after long-duration space flight","Optic Disc Edema, Globe Flattening, Choroidal Folds, And Hyperopic Shifts Observed In Astronauts After Long-duration Space Flight",70,10.1016/j.ophtha.2011.06.021,https://w3id.org/oc/meta/br/0629029489,author_title
b15,Risk factors for visual field progression in the low-pressure glaucoma treatment study,Risk Factors For Visual Field Progression In The Low-pressure Glaucoma Treatment Study,70,10.1016/j.ajo.2012.04.015,https://w3id.org/oc/meta/br/06240909681,author_title
b19,Facts and myths of cerebrospinal fluid pressure for the physiology of the eye,Facts And Myths Of Cerebrospinal Fluid Pressure For The Physiology Of The Eye,50,10.1007/978-981-13-2137-5_12,https://w3id.org/oc/meta/br/06302558931,author_title
