reference_id,article_title,matched_title,score,matched_doi,meta_id,query_type
b0,Homopolysaccharides from lactic acid bacteria,Homopolysaccharides From Lactic Acid Bacteria,70,10.1016/s0958-6946(01)00113-3,https://w3id.org/oc/meta/br/06120384846,author_title
b1,"Dextran molecular size and degree of branching as a function of sucrose concentration, pH, and temperature of reaction of Leuconostoc mesenteroides B-512FMCM dextransucrase","Dextran Molecular Size And Degree Of Branching As A Function Of Sucrose Concentration, pH, And Temperature Of Reaction Of Leuconostoc Mesenteroides B-512FMCM Dextransucrase.",70,10.1016/s0008-6215(03)00148-4,https://w3id.org/oc/meta/br/06150532399,author_title
b2,Ultrasonic degradation of aqueous dextran: Effect of initial molecular weight and concentration,Ultrasonic Degradation Of Aqueous Dextran: Effect Of Initial Molecular Weight And Concentration,70,10.1016/j.carbpol.2012.05.064,https://w3id.org/oc/meta/br/06110166837,author_title
b3,Controlling the oral biofilm with antimicrobials,Controlling The Oral Biofilm With Antimicrobials.,70,10.1016/s0300-5712(10)70005-1,https://w3id.org/oc/meta/br/06210698048,author_title
b4,Enzymatic removal and disinfection of bacterial biofilms,Enzymatic Removal And Disinfection Of Bacterial Biofilms,70,10.1128/aem.63.9.3724-3728.1997,https://w3id.org/oc/meta/br/06120263968,author_title
b5,Characterisation of polysaccharides synthesised by Gluconobacter oxydans NCIMB 4943,Characterisation Of Polysaccharides Synthesised By Gluconobacter Oxydans NCIMB 4943,70,10.1016/s0144-8617(00)00262-9,https://w3id.org/oc/meta/br/06230167272,author_title
b6,Regulated insulin release from biodegradable dextran hydrogels containing poly(ethylene glycol),Regulated Insulin Release From Biodegradable Dextran Hydrogels Containing Poly(Ethylene Glycol),70,10.1016/0168-3659(96)01456-3,https://w3id.org/oc/meta/br/06403291948,author_title
b8,Specific method for quantitative measurement of the total dextran content of raw sugar,Specific Method For Quantitative Measurement Of The Total Dextran Content Of Raw Sugar,70,10.1021/jf00014a012,https://w3id.org/oc/meta/br/0650950306,author_title
b10,Regional Specificity of Chlorhexidine Effects on Taste Perception,Regional Specificity Of Chlorhexidine Effects On Taste Perception,70,10.1093/chemse/bjm095,https://w3id.org/oc/meta/br/062103116122,author_title
b11,Microbial Dextran-Hydrolyzing Enzymes: Fundamentals and Applications,Microbial Dextran-Hydrolyzing Enzymes: Fundamentals And Applications,70,10.1128/mmbr.69.2.306-325.2005,https://w3id.org/oc/meta/br/061602788053,author_title
b12,Modified Substrates and Modified Products as Inducers of Carbohydrases,Modified Substrates And Modified Products As Inducers Of Carbohydrases,65,10.1128/jb.100.3.1151-1154.1969,https://w3id.org/oc/meta/br/066078824,author_title
b13,Stimulation of dextranase production by oxidized dextran,Stimulation Of Dextranase Production By Oxidized Dextran,70,10.1139/m70-141,https://w3id.org/oc/meta/br/06901619811,author_title
b14,Isomaltooligosaccharide increases cecal Bifidobacterium population in young broiler chickens,Isomaltooligosaccharide Increases Cecal Bifidobacterium Population In Young Broiler Chickens,70,10.1093/ps/84.7.998,https://w3id.org/oc/meta/br/06220803744,author_title
b15,Application of dextranases in sugarcane factory: Overcoming practical problems,Application Of Dextranases In Sugarcane Factory: Overcoming Practical Problems,70,10.1007/s12355-009-0020-x,https://w3id.org/oc/meta/br/06701424952,author_title
b16,Successful application of dextranase in sugar beet factories,Successful Application Of Dextranase In Sugar Beet Factories,70,10.5274/assbt.2011.59,https://w3id.org/oc/meta/br/062202973161,author_title
b17,Immobilization of dextranase from Chaetomium erraticum,Immobilization Of Dextranase From Chaetomium Erraticum,70,10.1016/j.jbiotec.2007.07.946,https://w3id.org/oc/meta/br/06110788177,author_title
b18,"Diphenylamine–Aniline–Phosphoric Acid Reagent, a Versatile Spray Reagent for Revealing Glycoconjugates on Thin-Layer Chromatography Plates","Diphenylamine–Aniline–Phosphoric Acid Reagent, A Versatile Spray Reagent For Revealing Glycoconjugates On Thin-Layer Chromatography Plates",70,10.1006/abio.2000.4829,https://w3id.org/oc/meta/br/06230983733,author_title
b20,Biosynthesis of oligodextrans with different Mw by synergistic catalysis of dextransucrase and dextranase,Biosynthesis Of Oligodextrans With Different Mw By Synergistic Catalysis Of Dextransucrase And Dextranase,70,10.1016/j.carbpol.2014.06.018,https://w3id.org/oc/meta/br/0680164304,author_title
b21,Expression and secretion of an Arthrobacter dextranase in the oral bacterium Streptococcus gordonii,Expression And Secretion Of An Arthrobacter Dextranase In The Oral Bacterium Streptococcus Gordonii,70,10.1128/iai.61.10.4375-4381.1993,https://w3id.org/oc/meta/br/0670230673,author_title
b22,Induction of Lipomyces starkeyi Dextranase,Induction Of Lipomyces Starkeyi Dextranase,70,10.1128/aem.55.8.2079-2081.1989,https://w3id.org/oc/meta/br/06150265249,author_title
b24,Dextransucrase constitutive mutants of Leuconostoc mesenteroides B-1299,Dextransucrase Constitutive Mutants Of Leuconostoc Mesenteroides B-1299,70,10.1016/0141-0229(95)00039-9,https://w3id.org/oc/meta/br/06603552987,author_title
b26,"Purification, characterization, and application of a thermostable dextranase from Talaromyces pinophilus","Purification, Characterization, And Application Of A Thermostable Dextranase From Talaromyces Pinophilus",65,10.1007/s10295-016-1886-8,https://w3id.org/oc/meta/br/06240561434,author_title
b28,Antibiofilm Activity of α-Amylase from Bacillus subtilis S8-18 Against Biofilm Forming Human Bacterial Pathogens,Antibiofilm Activity Of α-Amylase From Bacillus Subtilis S8-18 Against Biofilm Forming Human Bacterial Pathogens,70,10.1007/s12010-011-9526-2,https://w3id.org/oc/meta/br/06230263048,author_title
b29,"Cloning, expression, and purification of a recombinant cold-adapted β-galactosidase from antarctic bacterium Pseudoalteromonas sp. 22b","Cloning, Expression, And Purification Of A Recombinant Cold-Adapted Β-Galactosidase From Antarctic Bacterium Pseudoalteromonas Sp. 22B",70,10.1016/j.pep.2004.09.002,https://w3id.org/oc/meta/br/0690202383,author_title
b30,Properties of cold-adapted microorganisms and their potential role in biotechnology,Properties Of Cold-Adapted Microorganisms And Their Potential Role In Biotechnology,70,10.1016/0168-1656(94)90093-0,https://w3id.org/oc/meta/br/06130781131,author_title
b31,Biocatalytic potential of an alkalophilic and thermophilic dextranase as a remedial measure for dextran removal during sugar manufacture,Biocatalytic Potential Of An Alkalophilic And Thermophilic Dextranase As A Remedial Measure For Dextran Removal During Sugar Manufacture,70,10.1016/j.biortech.2012.01.002,https://w3id.org/oc/meta/br/06180116824,author_title
b36,"Catenovulum sediminis sp. nov., isolated from coastal sediment","Catenovulum Sediminis Sp. Nov., Isolated From Coastal Sediment",70,10.1099/ijsem.0.002219,https://w3id.org/oc/meta/br/061603148197,author_title
b37,Dextranases from oral bacteria: inhibition of water-insoluble glucan production and adherence to smooth surfaces by Streptococcus mutans,Dextranases From Oral Bacteria: Inhibition Of Water-Insoluble Glucan Production And Adherence To Smooth Surfaces By Streptococcus Mutans,70,10.1128/iai.12.2.309-317.1975,https://w3id.org/oc/meta/br/06220223352,author_title
b38,Purification and characterization of a dextranase from Sporothrix schenckii,Purification And Characterization Of A Dextranase From Sporothrix Schenckii,70,10.1007/s002030050619,https://w3id.org/oc/meta/br/062302835622,author_title
b39,"Purification, characterization and end product analysis of dextran degrading endodextranase from Bacillus licheniformis KIBGE-IB25","Purification, Characterization And End Product Analysis Of Dextran Degrading Endodextranase From Bacillus Licheniformis KIBGE-IB25",70,10.1016/j.ijbiomac.2015.04.007,https://w3id.org/oc/meta/br/06160416011,author_title
b40,Isolation and characterization of a thermostable dextranase,Isolation And Characterization Of A Thermostable Dextranase,70,10.1016/s0141-0229(96)00118-4,https://w3id.org/oc/meta/br/06603552865,author_title
b41,The purification and characterization of a dextranase from Lipomyces starkeyi,The Purification And Characterization Of A Dextranase From Lipomyces Starkeyi,70,10.1111/j.1432-1033.1989.tb14908.x,https://w3id.org/oc/meta/br/06101247327,author_title
b42,Characterization of a marine-derived dextranase and its application to the prevention of dental caries,Characterization Of A Marine-Derived Dextranase And Its Application To The Prevention Of Dental Caries,70,10.1007/s10295-013-1369-0,https://w3id.org/oc/meta/br/06250567898,author_title
b43,"Extracellular α-Glucosidase with Dextran-Hydrolyzing Activity from the Thermophilic Fungus, Thermomyces lanuginosus","Extracellular α-Glucosidase With Dextran-Hydrolyzing Activity From The Thermophilic Fungus, Thermomyces Lanuginosus",70,10.1007/s002849900092,https://w3id.org/oc/meta/br/061101831787,author_title
b47,Biochemical characterization of dextranase from Arthrobacter oxydans and its cloning and expression in Escherichia coli,Biochemical Characterization Of Dextranase From Arthrobacter Oxydans And Its Cloning And Expression In Escherichia Coli,70,10.1007/s10068-010-0106-y,https://w3id.org/oc/meta/br/061601946744,author_title
b48,"Anandins A and B, Two Rare Steroidal Alkaloids from a Marine Streptomyces anandii H41-59","Anandins A And B, Two Rare Steroidal Alkaloids From A Marine Streptomyces Anandii H41-59",70,10.3390/md15110355,https://w3id.org/oc/meta/br/062601515551,author_title
b50,Effect of 5% fluoride varnish application on caries among school children in rural Brazil: a randomized controlled trial,Effect Of 5% Fluoride Varnish Application On Caries Among School Children In Rural Brazil: A Randomized Controlled Trial,65,10.1111/j.1600-0528.2011.00656.x,https://w3id.org/oc/meta/br/0660734434,author_title
b51,Use of Dinitrosalicylic Acid Reagent for Determination of Reducing Sugar,Use Of Dinitrosalicylic Acid Reagent For Determination Of Reducing Sugar,70,10.1021/ac60147a030,https://w3id.org/oc/meta/br/06501008598,author_title
b52,Adherence of coagulase-negative staphylococci to plastic tissue culture plates: a quantitative model for the adherence of staphylococci to medical devices,Adherence Of Coagulase-Negative Staphylococci To Plastic Tissue Culture Plates: A Quantitative Model For The Adherence Of Staphylococci To Medical Devices,70,10.1128/jcm.22.6.996-1006.1985,https://w3id.org/oc/meta/br/06110446336,author_title
b53,Effect of MUC7 peptides on the growth of bacteria and on Streptococcus mutans biofilm,Effect Of MUC7 Peptides On The Growth Of Bacteria And On Streptococcus Mutans Biofilm,70,10.1093/jac/dkl120,https://w3id.org/oc/meta/br/062301864594,author_title
b54,Antimicrobial and antibiofilm activity of pleurocidin against cariogenic microorganisms,Antimicrobial And Antibiofilm Activity Of Pleurocidin Against Cariogenic Microorganisms,70,10.1016/j.peptides.2011.06.008,https://w3id.org/oc/meta/br/06801254606,author_title
